round,players,round_placement,points,matches,wins,avg_elims,avg_place
Round1,"ll Knox ll, IG LilC4bron, Hyst Juzo",8214,80,9,0,2.89,12.78
Round1,"DIOR Batrii, ISO siidhhu, Χyro ay лол",8215,80,9,0,2.89,13.89
Round1,"Idan g money, Snakysiren3167, Fuzzy For Hokage",8216,80,10,0,2.7,14.4
Round1,"ɪꜱᴍᴀ ʙɪᴊᴜᴜ ᴍᴏᴅᴇ, CORONA イ, Aletz ᴏɴ ᴅʀᴜɢꜱ",8217,80,10,0,2.7,14.9
Round1,"ᴴʳᵈᶻ Andre ک, ᴴʳᵈᶻ Mario ϟ, ᴴʳᵈᶻ Charlie 火",8218,80,10,0,2.7,15.2
Round1,"juni iwnl, ɳεเƭɦ ay лол, KΞvs iwnl",8219,80,10,0,2.7,15.6
Round1,"TM-Khun, NAJARROchris, sandertatoes123s",8220,80,10,0,2.7,15.7
Round1,"Twitch Nextbuild, lustfiム, DarkFriend12345",8221,80,10,0,2.7,15.7
Round1,"ExoticK1006, TTVJorszn, Spydder〆",8222,80,10,0,2.7,17.0
Round1,"Coach Prince, TTV CxrryFN, contii.",8223,80,10,0,2.7,17.1
Round1,"canoon 技, Andysda45, ByP4X.",8224,80,10,0,2.6,15.8
Round1,"YMaruchanz, Your M0M Killyou, ElAlliege de mty",8225,80,10,0,2.6,16.5
Round1,"Big Beto 713, Jynkzsfy, Jynkzsify is BOT",8226,80,10,0,2.6,16.7
Round1,"jhackz., shmoop., Klovers.",8227,80,10,0,2.6,16.9
Round1,"L2 Dragon, Тrashay, Pedro ﾒ",8228,80,10,0,2.6,17.1
Round1,"Twyster., Spxdeyz ℵ, syko 父",8229,80,10,0,2.5,13.8
Round1,"Twitch Fn_Alejo, BLK_YankiΨ, BLK_HarichoΨ",8230,80,10,0,2.5,13.9
Round1,"Demonalight, Pegazus44, KahnFN",8231,80,10,0,2.5,15.0
Round1,"TtvKingPickleKy, twmprr, Ree soul",8232,80,10,0,2.5,15.7
Round1,"alex -ω-, Viper. X, Spit On Youツ",8233,80,10,0,2.5,15.9
Round1,"HowDaddyDo, Ladchamber, Melz1x.",8234,80,10,0,2.5,16.1
Round1,"tertlee, Use Code DuffyFN, YRN talkb",8235,80,10,0,2.4,14.9
Round1,"TC T0MMY, Wiz Gone Rogue ゑ, Juzo文",8236,80,10,0,2.4,17.4
Round1,"FuzzyIsLit, M3 On Crack, FNCS Buds",8237,80,10,0,2.3,14.1
Round1,"FNCS Craythx, Darkkiller928, Acrylic On Claw",8238,80,10,0,2.3,14.9
Round1,"Ares Slip, DrMario1981, Ares GingerM18",8239,80,10,0,2.3,15.3
Round1,"Zealo., Krakemon 私, snaggy tay",8240,80,10,0,2.3,16.1
Round1,"Drôwsy., holdnn, i like men lolll",8241,80,10,0,2.2,14.5
Round1,"Expo_MED., hammaad3, ENDLESS EKOPEK",8242,80,10,0,2.2,14.7
Round1,"fer24crack, ronnie ζ, brandonbrandonal",8243,80,10,0,2.2,14.7
Round1,"2x Alpha Zach, Miѕtic, 1x Alpha Jack",8244,80,10,0,2.2,14.8
Round1,"fncs homerun, fncs cozz, fncs shifu ツ",8245,80,10,0,2.2,14.9
Round1,"GeorgeFloydxx, ninja is a b3ast, smdㅤㅤ",8246,80,10,0,2.2,17.6
Round1,"OF Dingle, lil Grλv, Big Grava",8247,80,9,0,2.11,13.78
Round1,"Team Flikk, Sollazzo08, EverydayClownzTV",8248,80,10,0,2.1,13.5
Round1,"SneeryLoves.Caty, ᴳᵒᵈメB R 大 N D 乡, CΔRLOSメ",8249,80,10,0,2.1,13.7
Round1,"Moshi 卄, Litmansauce, Vlaster 卄",8250,80,10,0,2.1,14.6
Round1,"jimb0gaffs, vNárk, BEEFCAΚE",8251,80,10,0,2.1,15.1
Round1,"TR deqz父, lil uzi tr1ppieメ, Editor Super",8252,80,10,0,2.1,16.9
Round1,"Syferw, XLuis98xx, OSCARTHEBLACKBOY",8253,80,9,0,2.0,13.0
Round1,"D e m o n I c z, Swfty on XNXX, Elmeerx",8254,80,10,0,2.0,13.6
Round1,"D3møn7, DxGody, jcvazquez15",8255,80,10,0,2.0,13.9
Round1,"Slloomy, Alvynツ, DominicToreto ツ",8256,80,10,0,2.0,14.1
Round1,"Rz ΞlPЯIMΘᶠᴬᴷᴱ, Rz Marki, βiπcξ",8257,80,10,0,2.0,14.5
Round1,"ʲˢʷSyake, authentiqq., fncs ryser.",8258,80,10,0,2.0,16.5
Round1,"marionSZNツ, Hollywood-_-Ken, Keystan3x",8259,80,10,0,1.9,13.7
Round1,"Twitch Juicea2, ant ique, Scump Ψ",8260,80,10,0,1.9,15.0
Round1,"Ɒarrien, Fissile ay лол, kyane weast",8261,80,10,0,1.9,15.4
Round1,"Ψurdaddy, ΨDemonDonnyyy, Ѱ ЅНФЩТІМЄ",8262,80,10,0,1.9,16.8
Round1,"Ðәґά ay лол, ᴄᴀʀʟᴏꜱ ꜱɪɴ ɴᴏᴠɪᴀ, Tomy pezqueñin",8263,80,10,0,1.8,13.2
Round1,"KP_Loboaguila15, Not KikeR7, PIECE CTRL TR0LL",8264,80,10,0,1.8,13.8
Round1,"WoahJB, Josegetsmoneyy, Stekashy",8265,80,10,0,1.8,14.1
Round1,"Cuban Tntke1, ThiccBoyBoo, Stepbro Braylon.",8266,80,10,0,1.8,14.5
Round1,"CIAO.Ferrari, Tow1997, BTerrible",8267,80,10,0,1.8,15.4
Round1,"DhariusTrapp, mcjack10marco, toro418arisco",8268,80,9,0,1.78,11.22
Round1,"noonen14, MVayda, OG MoWGLi93",8269,80,10,0,1.7,13.3
Round1,"AstroFNBR., TTV Tybowling, UAC Asova.",8270,80,10,0,1.7,15.2
Round1,"greatLAKE98, youngmikefn, TTV mattyb120",8271,80,10,0,1.7,15.3
Round1,"THS_skully, LIGHT_shak10, LIGHT_gesam12",8272,80,9,0,1.67,11.11
Round1,"Ciphen., Barrettψ, 200IQSpeedyCody",8273,80,9,0,1.67,13.44
Round1,"EpikGrey, βαd Ρlayer Ϲalii, tormonǃ",8274,80,10,0,1.6,13.7
Round1,"mtn dorasboots, phaculty 文, GhTKingPinKush",8275,80,10,0,1.6,14.1
Round1,"Marco Ψ, Yiyyii On PSち, huevito_009",8276,80,10,0,1.6,14.3
Round1,"Not-DannyXD, ϟturєץᴘaᴘiツ, Ꮆㄖ几乙卂ㄥ乇乙",8277,80,10,0,1.6,14.7
Round1,"HaxbiiTTV, MSchmitt17, TTV ItsSTF1",8278,80,10,0,1.6,14.9
Round1,"WCKD_Skillz, Tell Ya Mama, aGladLad",8279,80,9,0,1.56,10.89
Round1,"TheDarkG_, a_mimirツ, AM_RIKITOSO",8280,80,10,0,1.4,14.6
Round1,"jesusespinosa, KA Renato, KxnzyOnTop",8281,80,9,0,1.22,11.56
Round1,"Aunpollo, XDIEGO OC, Titianxpro14",8282,80,10,0,1.2,12.6
Round1,"AndrésQ1102, itsJulioHD, dan31599_",8283,80,10,0,1.2,13.6
Round1,"xbl(MONEYBAGS CASH), Peace Ctrl Keysﮎ, GarrettDaBest",8284,80,10,0,1.1,13.4
Round1,"Twitch blerr, Mathias ay лол ツ, Nlf_daniel2004",8285,80,9,0,1.0,11.44
Round1,"Ϲheeto, Coach Roach III, DropOff Rei",8286,80,10,0,0.9,12.6
Round1,"chris sa, JerryOnT0P, PXM_grios",8287,80,10,0,0.9,12.8
Round1,"Nicholas v2, 13SoccerPlayer13, 2Ty52",8288,80,10,0,0.8,13.2
Round1,"as s player, Mist LS, egreen703",8289,79,6,1,7.0,19.17
Round1,"FNCS Nelix, youtube yoSwag, KikFn.",8290,79,5,1,6.0,11.2
Round1,"Ghotzyyyyy, DEMONHOME ϟ, DEMONDARIO ϟ",8291,79,10,1,5.0,20.6
Round1,"Hateful Ϟ, YT Mr.LaZer, Kahsai",8292,79,10,1,4.0,17.1
Round1,"Rodo mata bots, SLZ Wynzex, New Perx ᚾ",8293,79,8,1,3.88,16.13
Round1,"Cap9 SilSuf, Spasies The Dilf, MistaClutchh",8294,79,9,1,3.78,18.22
Round1,"imBigHoss, BoomerMank, BigSosa1x",8295,79,10,1,3.7,19.3
Round1,"OP Chubs, tier 3 pro, OP Kcin",8296,79,10,1,3.7,19.9
Round1,"Moon 私, largejellocups ﾒ, TNA Dreamz",8297,79,10,1,3.6,19.5
Round1,"Autobot Mkey, demon nobs, Skipz 4 Hokage",8298,79,10,1,3.6,19.9
Round1,"ꜱᴄ ᴏᴘɪᴏ., ꓠano., TPG Zyli",8299,79,10,1,3.3,20.0
Round1,"ISAIAΗ, bizz ay лол, User-493f8552db",8300,79,10,1,3.1,16.0
Round1,"qualed., L-A-S-E-R, Asheesh.",8301,79,10,1,3.1,17.9
Round1,"Sturdy Rinku, Sturdy Jack, Sturdy Myst",8302,79,10,1,3.1,18.3
Round1,"mattymondo, Isōlated, Minxrr",8303,79,10,1,3.1,19.1
Round1,"Unlucky Goldz, SaihajSB, Fuгylol",8304,79,10,1,2.7,16.4
Round1,"Nick Hollywood., OGMADDOGTV, SHМOKED",8305,79,10,1,2.7,16.5
Round1,"Termo El Niño., Dúo de termo, RIFA LA NIÑA",8306,79,10,1,2.7,16.6
Round1,"piece ctrl doug, YT NotJonatan, rfizzer",8307,79,10,1,2.5,15.3
Round1,"Dylant -, Nils - 隻眼の王, Jerryperuanoψ",8308,79,10,1,2.5,15.4
Round1,"KN95 Caligood, Juli Best player, KN95 Pinedon",8309,79,10,1,2.5,16.3
Round1,"Dirty Sprite ϟ, A1Jaiden, Cool Kid Zax",8310,79,10,1,2.4,17.7
Round1,"TTV_Xyzxs, dagmawie10, GoatGvmgamingYT",8311,79,10,1,2.4,17.7
Round1,"igl deez, nog is washed, stqticgraal",8312,79,10,1,2.4,20.0
Round1,"jozi ay лол, Bantu SZN, Zyflin 父",8313,79,10,1,2.3,18.8
Round1,"Sparky.faboxッ, crgabss, shetу",8314,79,10,1,2.0,15.1
Round1,"cxwboy FC, Rainbow Jakie, they hate joseph",8315,79,10,1,1.5,13.7
Round1,"BlistFangz, mason_r_p_g, Twitch Gunthrala",8316,79,10,1,1.3,14.0
Round1,"Fx_khaos, IloveAnnaBananaツ, XEverVM",8317,79,10,1,1.2,13.4
Round1,"Ranchelot, m a r c y., MEGA_DRIEX",8318,79,10,1,1.0,16.1
Round1,"brnz ay лол, Fineѕse, AG Chickenboss",8319,79,10,1,0.9,15.2
Round1,"star ォ, Phar2crazyツ, Coolguy2.1",8320,79,7,0,6.14,13.0
Round1,"Worshep, picco boxed u, Scopеluckツ",8321,79,9,0,5.67,17.44
Round1,"Julіan Jett, AP Yoxi, Cloudywtf",8322,79,10,0,5.3,20.9
Round1,"Ø02 Gøku, Cristsxz神, Ｐｏｐｐｅｒ ｚｏｅｙ",8323,79,8,0,5.25,16.0
Round1,"xiLe Andrew ϟ, xiLe Lyv ツ, Simp de Yvng_Fer",8324,79,10,0,5.1,18.1
Round1,"2F Kray, shoota cold, 2F StaLis",8325,79,10,0,5.1,18.9
Round1,"Sontrell ϟ, akby smacks u, Splitsὣᾮ",8326,79,10,0,4.9,17.9
Round1,"nfake 车, Ivanyxک, ｎｏｂｕテ",8327,79,5,0,4.8,10.2
Round1,"acluu on Twitch, daezuL on Twitch, GRIZΖLY",8328,79,10,0,4.7,17.9
Round1,"FluX Lunar., NX PickleShikel., NX Filthy",8329,79,8,0,4.63,16.75
Round1,"radiant flat, 5agara., mαno ay лол",8330,79,10,0,4.6,18.1
Round1,"Jɑcob 〆, lil ozy vert., Cas ǃ",8331,79,10,0,4.6,19.7
Round1,"Јedi, aѕtrаl, zync vz",8332,79,10,0,4.6,20.7
Round1,"Comp playa Ciz, Sxvior Love Tito, Get BANG BANG",8333,79,7,0,4.57,12.71
Round1,"the big gigi, TKL Felix, nelly_MN",8334,79,10,0,4.5,17.7
Round1,"mia khalitruuu, Diego-α-, papuu 忮",8335,79,10,0,4.3,15.8
Round1,"TIKTOK XRETAKEZX, ʸᵒᵘᵗᵘᵇᵉ Qt Meli父, mx has softaim",8336,79,10,0,4.3,17.3
Round1,"Prokure, C9 Comp, Daddy Zurt",8337,79,10,0,4.3,18.6
Round1,"DK ǃ, Xcalaver908837, mightyzsmith8877",8338,79,8,0,4.25,16.38
Round1,"twitter zemon, Slapiin ﾒ, ItsAdr1anYT",8339,79,8,0,4.13,14.25
Round1,"brandn is saved, Jakey. 父, twizy.",8340,79,9,0,4.11,17.56
Round1,"Сameraman, papii ay лол, pаpi ay лол",8341,79,9,0,4.0,15.22
Round1,"sitx, Twistϟ, Twitch PsychoSNZ",8342,79,10,0,4.0,16.7
Round1,"eﱞco, Eternal kﱞuda, Dﱞaﱞe",8343,79,10,0,4.0,17.0
Round1,"Saynx.ϟ, SIMP DE PANESITO, LionFNツ",8344,79,10,0,4.0,17.9
Round1,"LaZy_AT0X, HCK chickenwings, YouTube StimY",8345,79,10,0,4.0,18.3
Round1,"Layzserd, Uncle Zazou, Viibz X RyZeツ",8346,79,10,0,3.9,15.6
Round1,"Manny gives Ls, Dumes, Twitch bookfn_",8347,79,9,0,3.89,16.33
Round1,"ItsKrispyz, Fire ξ, spladе",8348,79,10,0,3.8,15.9
Round1,"Еpiс Ꭵwnɭ, Toxic ツEmi, Pluto_L2R2.TV",8349,79,9,0,3.78,15.56
Round1,"ツAleTeDejaEn4ツ, Lⱥw, Elpicxel",8350,79,10,0,3.7,15.4
Round1,"Jamesyyツ, ZАINﱞ, twitch xdnich.",8351,79,10,0,3.7,15.8
Round1,"twitch justjaizo, dgsי, Hexzzy .",8352,79,10,0,3.7,17.4
Round1,"Ҡɾᵾɨʑツ, inward ., pls box me",8353,79,10,0,3.7,17.6
Round1,"Cronos on FB, Pan con milo, Heltics Zeus ϟ",8354,79,10,0,3.6,14.9
Round1,"DH Shalom, Mimo ., βεητhεβεasτ",8355,79,10,0,3.6,16.7
Round1,"jay dabdabdab, Iѕ0, Delау",8356,79,10,0,3.6,17.3
Round1,"WalŁer ay лол, Mattittude, FNCS Tylerrϟ",8357,79,10,0,3.6,17.6
Round1,"Lxvee., sishui芸者, Fiery Fearz",8358,79,10,0,3.6,17.8
Round1,"Repentance Ϟ, Nene ϟ, Αprilϟ",8359,79,10,0,3.6,18.0
Round1,"dripii simps, DyslexicSZN, ENDLESS SHRKSTER",8360,79,10,0,3.6,18.3
Round1,"nohsion, rys fan salix, Sorrowify",8361,79,10,0,3.6,18.4
Round1,"Mr Nimbus嵐.exe, L Ξ G Ξ N D.exe, XMAS Kolz.exe",8362,79,7,0,3.57,12.43
Round1,"Zaiah1122, piece ctrl frags, Strazberry Mango",8363,79,9,0,3.56,15.44
Round1,"FNCS W1z, fnshadyy, Ɍico",8364,79,10,0,3.5,15.8
Round1,"ᶻᶤᶯˣ, Binx FC 父, smart air",8365,79,10,0,3.5,16.4
Round1,"Nyler., Іzoid, MISTІC",8366,79,10,0,3.5,16.8
Round1,"Spiritchool, Mireles., feature frags",8367,79,10,0,3.5,16.9
Round1,"ᵀᴷ ᴰᵍᵒᵈک, KW_丹ภgie, KW COPL2 Ψ",8368,79,10,0,3.5,16.9
Round1,"Yt AeroBtw, Oshlx, Twitch Sn1pe_FN",8369,79,10,0,3.5,17.4
Round1,"C9 N O L Y, Piece Ctrl Darks, 99vinny",8370,79,10,0,3.5,18.5
Round1,"Kitty Cat Conner, Snuggsﮎ, wetosn",8371,79,10,0,3.5,19.3
Round1,"Urso Johnson, Zume Edits, Chinese Asians",8372,79,9,0,3.44,13.67
Round1,"Levi 读, ʟɢ ѕиαρρу Ψ13, ᴾᵘʳᵍᵉMinato德",8373,79,10,0,3.4,14.8
Round1,"FNCS ABDULA, FNCS APOLO ೮, Twitter Mufld",8374,79,10,0,3.4,15.0
Round1,"InfilFNCS, Хen Kiox, D9 Swyftyz",8375,79,10,0,3.4,16.5
Round1,"Doctor On Me, jtibbss, Demon Prof",8376,79,10,0,3.4,16.8
Round1,"Xottic.ㅤ, daddy sadly, Critical私ƾN",8377,79,10,0,3.4,16.8
Round1,"Qorsin, fﱞrﱞeﱞnﱞzﱞyﱞ, Bluez ア",8378,79,10,0,3.4,18.0
Round1,"ＮＡＶＹ, TTV GOLDEN_GTR, Shorys Morgan",8379,79,10,0,3.3,15.8
Round1,"Lost Cxuse, DnAッ, Ƭracy",8380,79,10,0,3.3,16.2
Round1,"JMOOKY., crueity on ttv, BlurrrrΨ",8381,79,10,0,3.3,17.0
Round1,"Patrako ϟ, Trackあ, KyLs Gasheta ツ",8382,79,10,0,3.3,17.0
Round1,"Kimth FN, Sky ay лол., Donato_Sebas",8383,79,10,0,3.3,17.1
Round1,"aleperuciYT, LeoSmat, SureKingOs",8384,79,10,0,3.3,17.2
Round1,"PH Mock, Rashdadd, Coach Defy",8385,79,10,0,3.3,17.5
Round1,"FNCS Foxy, I Luv Ana Banana, lil purl vert",8386,79,10,0,3.3,17.5
Round1,"Pele Cup Winner, Jahzymonn, 杰诶贼德诶艾",8387,79,10,0,3.3,17.6
Round1,"twitch batbtw, peytonnシ, Twitch Alphalol",8388,79,10,0,3.3,18.4
Round1,"NT_vexxyメ, NT_Alno, NT_oddz.",8389,79,10,0,3.2,14.4
Round1,"Pre-fire osama, OG_Lowry, Simpstuh",8390,79,10,0,3.2,16.4
Round1,"aiko xo, Controller Jax, soccerdude2143",8391,79,10,0,3.2,16.9
Round1,"Tﱞree, Koshﱞi, Twitch CrumpTF2",8392,79,10,0,3.2,18.2
Round1,"4V Bossy, 4V StatsSZN, WRB_Tiger",8393,79,10,0,3.2,18.6
Round1,"Critical_Adrix, FBJamilitp, TEEB 神",8394,79,10,0,3.1,14.5
Round1,"Camrinヅ, Χuituz, RageARage.",8395,79,10,0,3.1,16.4
Round1,"Robdog., YZxJelly, Nitro Rex YT",8396,79,10,0,3.1,16.5
Round1,"shaka ㅿ, t o a s ty, BC Tahoe",8397,79,10,0,3.1,16.6
Round1,"lappi 水, charles ϟ, Hoodiе",8398,79,10,0,3.1,18.2
Round1,"Twitch velc, Tossed1x, wxve1x",8399,79,10,0,3.1,18.6
Round1,"terbο, avоid, Twitch ZimzMafia",8400,79,10,0,3.0,15.8
Round1,"Dannielhg32, Axxnn ay Лол, ValidX_Shadow",8401,79,10,0,2.9,14.6
Round1,"Ellery аy лол, ᵀᴾᴴ Pooffe, ᵀᴾᴴ LaRiata",8402,79,10,0,2.9,15.6
Round1,"OP RAIN LOL, ᵂʳᵃˣ 父, yungg wonk",8403,79,10,0,2.9,16.0
Round1,"Zixilty 父, Rioff 父, Isauuts Youtube",8404,79,10,0,2.9,16.2
Round1,"vix loves kyah, Jxliаn, drо .",8405,79,10,0,2.9,16.6
Round1,"DieGuini., InboxFN, albertemtt",8406,79,10,0,2.9,16.6
Round1,"乂BH THEWUARSYT 乂, AngelCF.-., Maxter lolcontro",8407,79,10,0,2.9,17.3
Round1,"brownіe, Twitch Glaze1x, isaﱞiah",8408,79,10,0,2.9,18.2
Round1,"k1ngsuarєz, Cocshop, 二人 hurtadoara 二人",8409,79,9,0,2.89,13.22
Round1,"Floppa 資格あり, mex is lonely, Awyken ay лол",8410,79,9,0,2.89,15.89
Round1,"AlbeInYou, IGL Sova, ZEE on 冥王星",8411,79,10,0,2.8,14.7
Round1,"Ryan- _ -, Dane Needs Surge, MARCBaller2002",8412,79,10,0,2.8,15.6
Round1,"Ashton 8k dpi, Shifty FN, elongateethanTTV",8413,79,10,0,2.8,15.7
Round1,"Wuxlked, Vecortex., walkedxeh",8414,79,10,0,2.8,15.9
Round1,"Fragey〤, Asulo〤, Verdalite〤",8415,79,10,0,2.8,17.7
Round1,"FB-Argus, FB-MwA Argus, Elpanawalter die",8416,79,10,0,2.7,13.9
Round1,"ShiestyWrld, аctingliketommу, SKDougy5931",8417,79,10,0,2.7,15.1
Round1,"twitch Cozy, Kaiser Ya DiGG, Spirit YaDiGG",8418,79,10,0,2.7,15.2
Round1,"Kosay is bae, Øuday, Ibrα イ",8419,79,10,0,2.7,15.5
Round1,"Twitch Skies1x, Sniperz漢, Tazerwyd",8420,79,10,0,2.7,15.7
Round1,"ItsEntireRex, SonaRZz_, Cheater Diamond",8421,79,10,0,2.7,16.3
Round1,"яyzє., Daxh ﷻ, ᴸᵘˣʳᵅʸ Zєus ک",8422,79,10,0,2.7,16.4
Round1,"ΡlutoΨ, I Spit on TTV, ẋoẋo",8423,79,10,0,2.7,17.0
Round1,"SenshiStar, ttv kobiejr, ᴍᴏʟʟʏ.",8424,79,10,0,2.7,18.7
Round1,"C0LBY., Spindеr, YT QEEZY",8425,79,10,0,2.7,19.8
Round1,"Hail ㅤㅤ, yoProspect, Sren10k",8426,79,8,0,2.63,14.88
Round1,"Simp de Alexia., ELpendjo3000, BERTﾒ",8427,79,10,0,2.6,13.7
Round1,"j0sh3lahi, filcxh 수, NRG mririshmoose",8428,79,10,0,2.6,15.0
Round1,"667 491 4203, Oscarʙᴏᴛ, ᴶᵉⁱʲᵉⁱツ",8429,79,10,0,2.6,16.9
Round1,"Cel3z RealG4Life, Fxby RealG4Life, Dylxn Walsky.",8430,79,10,0,2.5,14.1
Round1,"RoaЯ, Ivandr10, Jonaxfire97",8431,79,10,0,2.5,16.1
Round1,"Lwiggs, MeCa ay лол, hi im wintrr",8432,79,10,0,2.5,16.1
Round1,"Juɐnjo-w-FNCS., Klotz FNCS, Ψ RΞX Ψ",8433,79,9,0,2.33,14.33
Round1,"cesar072582, Arcuz ay лол么, IG YoMCSS",8434,79,10,0,2.3,13.7
Round1,"Adrien_43214, TTV Leguis, Bambino2545",8435,79,10,0,2.3,15.9
Round1,"ᴼᵖᵈᵃⁿᵏʸᵗ, crothh, Twitch_ZaZalol",8436,79,10,0,2.3,16.2
Round1,"zJac., zDrien., Jimi_Hendrix.",8437,79,10,0,2.3,17.2
Round1,"CADIN07, MIKEY ON CANTVΨ, CENTA ACKERMAN",8438,79,9,0,2.22,11.78
Round1,"UHAVE0PR240HZ, ᶻₐᶰₑ, James ﮎ",8439,79,10,0,2.2,15.1
Round1,"waІІy, Tempo ψ, Titan Shift Ryft",8440,79,10,0,2.2,15.2
Round1,"SKYREMONN, Tank1knaT, iTipical",8441,79,10,0,2.2,17.2
Round1,"I Hate The Class, Ing DiaAz, Ing Rodro",8442,79,10,0,2.1,14.2
Round1,"FORCE_ArmandoCs, 14 BarceCs, 14 RyZe",8443,79,10,0,2.1,17.3
Round1,"ᴱᶜᵍIsaΨ, NRG KILAMB, ᴊᴇʀᴄʟᴏᴅ",8444,79,10,0,2.0,13.3
Round1,"smileyy ay лол, capoo ay лол, Stripes ay лол",8445,79,10,0,2.0,13.8
Round1,"fchacón, 不ᶜʳᶤˢᵗᵒᵇᵃˡ, simp de 4urorag.",8446,79,10,0,2.0,14.2
Round1,"孫JeZz, lx ay лол., qeozzlol.ϟ",8447,79,10,0,2.0,16.0
Round1,"TLC_Guanako69, 999 wolfiez ϟ, V1CKMON ᵀᶠ",8448,79,10,0,2.0,17.0
Round1,"Rapid.Ψ, Cheeks4Meeks, RezidyѰ",8449,79,10,0,1.9,13.1
Round1,"C6 ClawGang, C6 Kinggwyd Ψ., I. ARE. BLACK",8450,79,10,0,1.9,13.7
Round1,"ARK ESPARTANOS, PepeJeans14, MINITAVO",8451,79,10,0,1.9,14.3
Round1,"adtitties, YoCorifyy, delux 么",8452,79,10,0,1.9,15.4
Round1,"Brugs., D1v1son Go Brrrr, Shes Mine λ",8453,79,10,0,1.8,12.4
Round1,"Ck4l-Storm, DaddyFl3x, Papa sm3rf",8454,79,10,0,1.8,14.1
Round1,"TittanLoco, やingu, K a n e k ᴳ ᵒ ᵈ",8455,79,10,0,1.8,15.3
Round1,"MixCrix, Stingypppp4, YoutubePencilXO",8456,79,10,0,1.8,15.4
Round1,"HK Styleez, Hk ToXicホ, HkRevxnge운",8457,79,9,0,1.78,13.22
Round1,"Kley.山姆, nicozs consolbot, Zpplash ϟ",8458,79,10,0,1.7,13.9
Round1,"MapacheCrack555, Didactita1120, aldair iwnl",8459,79,10,0,1.7,13.9
Round1,"CΞSΛR, Ablaze60Fps, Deku禄",8460,79,10,0,1.7,14.9
Round1,"EuroJetツ, Bamॐ, TTV PhoenixsPc",8461,79,10,0,1.6,13.5
Round1,"saucey-w-, kizzy on 144hz, xXLAZZx_on_144hz",8462,79,10,0,1.6,13.9
Round1,"VillePieceCntrol, Verrecass 運, clixfan7",8463,79,10,0,1.6,15.0
Round1,"A8bomb, ninjawolf_23, Ezfloppy",8464,79,9,0,1.56,11.56
Round1,"Straw Hat Rainy, StormWalkerFN, FaZe Sway FϹ",8465,79,9,0,1.56,12.78
Round1,"RogersMX, ferrari2510004, CANELOTE23",8466,79,8,0,1.5,10.38
Round1,"S C A R 1 E D., CRIS 么メ, Juanmontes553",8467,79,10,0,1.5,12.1
Round1,"hdxgg, slay on chakra, SadikiKiller2018",8468,79,10,0,1.5,14.3
Round1,"GepeXツ, Rodd ay лол, sieger12_",8469,79,10,0,1.5,14.3
Round1,"Deal With Sauce, Nova 1s back, lufro ay лол",8470,79,10,0,1.5,14.7
Round1,"FNCS vixzy ϟ, Jplay20, Jessie cute",8471,79,10,0,1.5,16.1
Round1,"Pack2Money, ytkix on tiktok, 2EasyEH",8472,79,10,0,1.4,13.0
Round1,"TNA RazR, ʙis vemon grifin, Reese Was Taken",8473,79,10,0,1.4,15.3
Round1,"FreenzyΨ, dritzzf, υr pp is small",8474,79,10,0,1.4,16.9
Round1,"ElShowDeBeRnI, Jairosaraango, Acuton21",8475,79,10,0,1.3,12.7
Round1,"psn(make_v2), Macpiña2605, Frоwi",8476,79,10,0,1.3,13.0
Round1,"darrofn, Twitch Pinfps, andydong26",8477,79,10,0,1.1,13.2
Round1,"ᶠᵃᵏᵉ ᵉʲᵒᵘ, Kenigゃ, FacebookㅤPMoster",8478,79,10,0,0.7,11.7
Round1,"Kubikks, hydro ﱞ, TNA Sxlt",8479,78,8,1,4.5,18.0
Round1,"GaproxEc, Slikz Trxn Trio, Kltx Slikz Trio",8480,78,5,1,4.4,8.4
Round1,"H0HST, Pоsy, 5A Psycho",8481,78,10,1,4.2,20.0
Round1,"alejocuervo372, xKrudzy 龙, Step bro Killer",8482,78,8,1,3.88,17.25
Round1,"Buff Zayda, Flаkо, Twitch Stussyfps",8483,78,10,1,3.8,16.7
Round1,"Fаkuz, Luucuzzo, kiddo jr.",8484,78,10,1,3.6,19.7
Round1,"IGL Arab, Leeksひ, terryfgn",8485,78,10,1,3.5,17.2
Round1,"snyperhyper34, Xwizit on Twitch, psn(DTW__BREEEED)",8486,78,7,1,3.43,12.86
Round1,"DEYY FAN BOY, Tyler is 더 나은 선수, Max cant buildツ",8487,78,10,1,3.3,18.2
Round1,"Sheroup, Youtube Flowky, LeStuffDeFlowky.",8488,78,10,1,3.3,21.2
Round1,"ComiFN on YT, Duⲥk, NRG Rux",8489,78,10,1,3.2,17.8
Round1,"Vairis ϟ, Camo ϟ, RoyFN ツ",8490,78,9,1,3.11,18.11
Round1,"Bbg optify Ψ, FNCS Monclearツ, votkugi父",8491,78,10,1,3.1,15.8
Round1,"YT Guilmar黑, Amine1x ϟ, Ֆʏռȶɨʄʏʏ ll",8492,78,9,1,3.0,16.33
Round1,"jodijuan, samp_jr_08, juanjo2404",8493,78,10,1,3.0,17.9
Round1,"Ghoul 文, EVQZMON, RECKKZMON",8494,78,10,1,2.9,16.9
Round1,"krex on PH, Trippynxte, ᴅᴇᴍᴏɴ ᴄʟᴀʏ父",8495,78,10,1,2.7,18.0
Round1,"JZG Joshua W, zuga乂., L1L2了",8496,78,8,1,2.63,13.63
Round1,"Moncho Tactico, IGL juanpas, Fragger W神",8497,78,10,1,2.6,14.5
Round1,"Nott_Vibez, quality luvs zz., YTLiamPierce",8498,78,10,1,2.6,16.2
Round1,"RED174, ENDLESS VXRTEX, 500PR DEMON",8499,78,10,1,2.6,16.3
Round1,"tiktok ahmikey, yu ah hoe, deal with Kyl0",8500,78,10,1,2.6,19.7
Round1,"Salems350GYT, Bl1nkYT, 519355",8501,78,9,1,2.44,16.67
Round1,"waehfnn., IG dmeliofnla, DEMON Sweat.",8502,78,10,1,2.4,17.3
Round1,"βךƸυ, uR Yeϯro, Sﱞhea",8503,78,10,1,2.4,17.7
Round1,"YT YoGoldenz, yt itz Trixy., Topbutterball",8504,78,10,1,2.4,19.5
Round1,"GuerraPlayers.Ec, ᴾˢ4w4lMel, RBL elMors_UwU Ψ",8505,78,10,1,2.4,20.0
Round1,"TackettDoubles, dadi bones, fuzegravitytv",8506,78,10,1,2.3,18.3
Round1,"TWTTER Jonbball7, Cpare on Twitch, Sacreddwyd",8507,78,10,1,2.2,18.4
Round1,"LC_Toñito, JNicolas31., Pape2903",8508,78,10,1,2.1,16.1
Round1,"Baryonyx 音, Wild weliez, ronino on crack女",8509,78,10,1,2.0,14.5
Round1,"Sipi 鬼ちゃん, Tete 鬼ちゃん, Katz_Oficial",8510,78,10,1,2.0,15.3
Round1,"Snowyؼ, Nick욪, frosty욪",8511,78,10,1,1.9,15.6
Round1,"Jman Swager, Wawa Gunt4er, Dusora",8512,78,10,1,1.8,15.3
Round1,"YouTube DlxDz, Slayyer么., Twitter Xardz",8513,78,10,1,1.7,15.4
Round1,"aniksebrio., TikTok Cheto, Batmanlieber",8514,78,10,1,1.6,17.1
Round1,"CL1 ﾒ, Snayᴳᵒᵈ, CHRISTIAN CRC",8515,78,10,1,1.6,17.6
Round1,"Apocalypseㅤ, monkey 丟, 黒 wept",8516,78,9,1,1.33,14.67
Round1,"BFB_BlossomyGolf, Carmona3133, BFB_Gari River",8517,78,9,1,1.11,11.67
Round1,"asadψ, roroψ, Lil Shriver",8518,78,5,0,6.8,10.0
Round1,"kahari ., ENDﱞLESS DEYY, PLZ Hex Cancels",8519,78,9,0,6.11,18.33
Round1,"Sow Landow, Kyubi 옺, chupi_of",8520,78,10,0,5.3,18.8
Round1,"Pure Ant, Ig Tu.Justo, Twitch ProspexTV",8521,78,10,0,4.8,16.5
Round1,"Youtube Rockie74, Tyler 霆, jewish ronaldo",8522,78,10,0,4.7,18.0
Round1,"slimeytay., ramシ., jaclar.",8523,78,10,0,4.6,19.0
Round1,"Garet ay лол, Michael Estrada., Walter Ayoví",8524,78,10,0,4.4,18.7
Round1,"1P Bryce, 1P Thunder, equǐp",8525,78,8,0,4.38,16.75
Round1,"TikTok_Sleazyfnn, ENDLESS EXPO, twitch chrizz1x",8526,78,10,0,4.3,16.4
Round1,"twitch bowsernm., Jinkzhy ., Olivia Holt.",8527,78,8,0,4.25,15.88
Round1,"DEMONSWAYZ, YouTube Alphalol, BeyBlade Shadows",8528,78,10,0,4.2,15.9
Round1,"true is sad, pika2dachu YT, TIG Zay",8529,78,10,0,4.1,20.3
Round1,"уekzy, Sashablouse629, Hokage Snapp ﮎ",8530,78,10,0,4.0,14.8
Round1,"CQ-Guts Vendetta, Twitch JawziFn, piece ctrl Musl",8531,78,10,0,4.0,19.0
Round1,"Twitch isnice, pickle wickles, Daddy Muppet",8532,78,10,0,3.9,16.8
Round1,"ГxГ, Tokyo Vanity, ArchBarch_",8533,78,10,0,3.9,17.3
Round1,"lil Sulli vert, lil Spazzy vert, XTRA pekslol",8534,78,10,0,3.9,17.9
Round1,"ElAlacranΔ, OG-ΕDGAR, Elgallooooo",8535,78,10,0,3.8,16.1
Round1,"AsTro Arhelys 父, sonderr., Jiggy After Clix",8536,78,10,0,3.8,16.6
Round1,"ᵉlectrⁱc, Ajay in champs, Zeus36787",8537,78,8,0,3.75,14.25
Round1,"Skyon120fps, Rﱞуze, waﱞkе",8538,78,10,0,3.7,15.3
Round1,"Alexis el SixeL, Romシ, OldSantos.",8539,78,10,0,3.7,15.7
Round1,"Twitch xxbliz, Simba FC, YouTube OD Vibez",8540,78,10,0,3.7,16.5
Round1,"1400 cloud, Nexi 父, 1004 chaotic",8541,78,10,0,3.7,18.2
Round1,"999 Jackie, R1 Specz, R1 butter",8542,78,9,0,3.56,15.44
Round1,"Nugget Jorge, brave lester-, Nugget skyeer",8543,78,10,0,3.5,15.8
Round1,"wezzyζ, TTV blankSZYN, ȿlⱸⱸɀƴ ϟ",8544,78,10,0,3.5,16.7
Round1,"Clixs bf, Twitch Zurpxtv, Prespec",8545,78,10,0,3.5,17.8
Round1,"Z3uS 0 de ping, kilodehueva, DEMONZEBS",8546,78,10,0,3.4,15.5
Round1,"Aromuh, midu., stfu xroe",8547,78,10,0,3.4,16.2
Round1,"RemedyLikesMEN, VibinKai, LegendsLikesMen",8548,78,10,0,3.4,16.3
Round1,"Chr1s ., Twitter Contr, Ventura Vorce",8549,78,10,0,3.4,16.8
Round1,"Platϟ, sȃetia, UFO Jacob",8550,78,10,0,3.4,19.0
Round1,"BeamoΨ, piece ctrl Icyyツ, yt_HgRorySoccer",8551,78,10,0,3.4,19.9
Round1,"Spine, ttv tayshaal, Lucczg ay лол",8552,78,10,0,3.4,20.5
Round1,"TTV KTSLlama, Not Shpeel, Thicc Daddy Zhi",8553,78,10,0,3.3,15.6
Round1,"Alonzoou, ihory love weed, essteban.DRK",8554,78,10,0,3.3,17.1
Round1,"SnippySniperYT, RenoΔ, Dreamy on IGL",8555,78,10,0,3.3,17.3
Round1,"Tupapimorote21, NewNxva_, Focus Nash",8556,78,10,0,3.2,15.7
Round1,"JJGoated, SamStoner11, Clix Is Hot",8557,78,10,0,3.2,17.1
Round1,"edugeni1011, DM8A ⁱˢ ᵍᵒᵈ, Magofishy ホ",8558,78,9,0,3.11,13.0
Round1,"ᴴᵁᴻᵀᴲᴿ 乀, CAPS LOCK QN8, goodgamebro657",8559,78,9,0,3.11,14.89
Round1,"Кіddy, gllobet25, JOSETE TÁCTICO",8560,78,10,0,3.1,14.3
Round1,"Fake Tiglet, ITYW, ZenoThe2nd",8561,78,10,0,3.1,15.4
Round1,"Rumpyy YouTube, Notaek., YouTube Noblerz",8562,78,10,0,3.1,16.8
Round1,"MTLITY slaky, MTLITY Lnciii, WillQC.",8563,78,10,0,3.1,18.0
Round1,"ez by Hatxaks, Deadshot 2828, Ez By Yeet",8564,78,10,0,3.1,18.6
Round1,"titan is daddy, XL Burzum, Kouzzy YT",8565,78,9,0,3.0,14.56
Round1,"sɪᴍᴘᴅᴇᴀsᴛʀɪᴅ, TMC Zëro, The big Shaw",8566,78,10,0,3.0,15.8
Round1,"Elite_jay_56, RexOnSixty, emericobro yt",8567,78,10,0,3.0,16.0
Round1,"ᴺᵘᵐᵇHekz, 1RLY Nozt メ, 7F Tito",8568,78,10,0,3.0,16.2
Round1,"jelly snail, L2 is on gxybox, cоulоurs",8569,78,10,0,3.0,16.2
Round1,"ꝈｏꝈ, Speetホふ, Moroズ",8570,78,10,0,3.0,16.3
Round1,"Mr Ryes, NV Snow ϟ, Nv DeathZy",8571,78,10,0,3.0,17.7
Round1,"zaki2x, nxyl ay лол, little luvs nxyl",8572,78,10,0,3.0,18.1
Round1,"sigzlol, Shiesty Runtz, ttv jordynrae",8573,78,10,0,3.0,18.4
Round1,"Isaacfishyツ, karmaaaafn on ig, Best Player HN",8574,78,10,0,2.9,15.3
Round1,"We Love You XVI, YouTube Celtix, Caziry eats bugs",8575,78,10,0,2.9,15.5
Round1,"xtintcz, Noox Ψ, xLeiv 水.",8576,78,10,0,2.9,16.1
Round1,"Habibi is washed, Calzone Crea, Rubio on Covid",8577,78,10,0,2.9,16.4
Round1,"Рiеcе Соntrоl, TSkillzzz Ψ, AquaForWave",8578,78,10,0,2.9,16.8
Round1,"TYPHOON 父, fleenastyネ, Вladе.",8579,78,10,0,2.9,17.2
Round1,"FreezyGG, YT Dafam, EclispeFN",8580,78,10,0,2.9,17.5
Round1,"AC Ashk, GODSENT uhnda, CHAPO SCRIMS",8581,78,10,0,2.9,18.0
