round,players,round_placement,points,matches,wins,avg_elims,avg_place
Round1,"Chupa ζ, SSJ Sebek, xyqn.",3037,110,10,0,4.2,13.0
Round1,"Sullyx2, Jcаv, Moonopoly",3038,110,10,0,4.2,14.1
Round1,"Eclipse Humer, KR Phantom, Jack On 0 PR",3039,110,10,0,4.2,14.5
Round1,"ArsenicSZN, itsChadz, YuhNick",3040,110,8,0,4.13,12.63
Round1,"zach私, Zenix 父, Webner",3041,110,9,0,4.11,11.22
Round1,"Pheye, akacolt, Blezi on YT",3042,110,10,0,4.1,14.1
Round1,"ム Pollo, 艾 Netxy, ム Britanics",3043,110,10,0,4.0,11.8
Round1,"RexzFN_, Spezzy On 144Hz, Lλgs",3044,110,10,0,4.0,13.3
Round1,"PHILIKZ, sponge FC YT, lil hushh",3045,110,10,0,3.9,13.6
Round1,"you are free lul, brendan ﾒ, хоrb",3046,110,10,0,3.9,14.0
Round1,"NoT eZ I7, Fluvツ, doraimon-约瑟",3047,110,10,0,3.8,12.9
Round1,"riderfnn, Mythic Kdust, cap6.",3048,110,10,0,3.8,14.5
Round1,"Monks grief qual, RSV Borg, RSV Faki",3049,110,10,0,3.7,13.4
Round1,"Arminbg, syukLux, Hijo de jatzw",3050,110,10,0,3.7,14.0
Round1,"piece ctrl bilIy, piece ctrl biIIy, piece ctrl biIly",3051,110,10,0,3.7,14.7
Round1,"TD Nawer, TD Ing.Enious火影, TD Mytrax.",3052,110,9,0,3.67,10.56
Round1,"tden1x, Patacus Ψ, YouTube SeaUma",3053,110,10,0,3.6,15.0
Round1,"рro_lolito123, Twitch Foresitoo, Twitch Igoom11",3054,110,9,0,3.56,11.56
Round1,"mоns, shift1x on yt, HECKLERS.",3055,110,9,0,3.56,11.89
Round1,"iiDud-, H1ckey248, UrBoxedBozo",3056,110,8,0,3.5,8.25
Round1,"Davenport Simps, TheRealAndo, fncs chiboyy",3057,110,10,0,3.5,11.9
Round1,"Twitch Zodaxes, ｋａｌｅｂズ, Jake私",3058,110,10,0,3.4,13.2
Round1,"Saerc 爱, Simp de Julieta., Smoke Pollo 枯",3059,110,10,0,3.4,13.6
Round1,"krayola., YouTube Phonenyi, YETMONッ",3060,110,10,0,3.4,14.4
Round1,"YT Wacho 1 IQ, TtvDragonFiree98, Twitch Demon1ck",3061,110,10,0,3.3,14.1
Round1,"Twitch Prz1x, agentoad1, DEMON TEKASHII",3062,110,10,0,3.2,12.2
Round1,"Gian メ, Jervizzz, Jerviz-",3063,110,9,0,3.11,10.56
Round1,"Deal with Radeon, CAP Sparkzee45YT, ClassyΨ",3064,110,10,0,3.1,14.4
Round1,"NigkEr 69, Saint Ф Ѱ, Vali ひが",3065,110,9,0,3.0,9.89
Round1,"Segs 〆, EZG SniperBerrox, might wanna vod",3066,110,10,0,3.0,14.2
Round1,"cаppers, StellarFN YT, goat9836fan",3067,110,10,0,2.9,14.1
Round1,"Dmxtri, twitch fleshyqt, Curr ㅿ",3068,110,9,0,2.89,11.0
Round1,"Emmanuel Ø, IGL Error, Maintainrr",3069,110,10,0,2.7,12.5
Round1,"drei Käse Jeff, Snoxyzz., Sxnti sus",3070,110,10,0,2.6,13.0
Round1,"FNCS Spirit., CometTheStreamer, FNCS Devvoh",3071,110,9,0,2.56,9.89
Round1,"DavidAlb19111, YT_ALENEGORT, SALX_02",3072,110,10,0,2.4,12.1
Round1,"djharrymusicTV, barislice, Logo7909",3073,110,9,0,2.33,10.44
Round1,"TTV Dotablaze, гising, SD dev",3074,110,10,0,1.8,12.0
Round1,"DRICEx2, lovely kila., JC GO OWA OWA",3075,109,7,2,6.57,14.14
Round1,"Lgbtq Grapes, Youtube Riality, FA Koda",3076,109,9,2,4.33,14.44
Round1,"Jоvanny, Coyner نوح, Putridux",3077,109,10,2,4.3,17.0
Round1,"TPI Diablolocura, TheFenix Youtube, Jasiel ah okey",3078,109,10,2,3.7,14.2
Round1,"PubeFn, Mr articcc, DasaniFN-YT",3079,109,10,2,3.7,16.9
Round1,"〆丂ㄒ尺乇匚卄雷茲〆, SPTitan米, Trash in 2021",3080,109,9,2,3.67,14.56
Round1,"BH Lightning, censurry, Frase.",3081,109,9,2,3.22,12.56
Round1,"FNCS Blitz., floppa〆, FNCS Elemintz",3082,109,10,2,3.0,13.5
Round1,"Exzy.gg, Loagz on SARMS, Pillowrr",3083,109,10,2,3.0,14.1
Round1,"debobed, Twitch sznalGIO, lukyب",3084,109,10,2,2.7,13.8
Round1,"メTyr_Danielメ, DalexMX., Tyr_Albañil",3085,109,10,2,2.3,13.2
Round1,"Jamal ღ, Clear Eclipz YT, Echoz ζ",3086,109,9,1,6.33,16.11
Round1,"kraigalwaysthrow, Yo soy dogger, ShelledIsTaken",3087,109,10,1,6.3,18.9
Round1,"Otzy ツ, polvo 1234xd, Betito bot车",3088,109,9,1,5.22,12.67
Round1,"ħʉģǿΨ, 2021 JRϟ, Vlouϟ",3089,109,9,1,5.22,13.78
Round1,"Fragger Paw, Chrizzy on SARMS, Zellyy-YT Ψ",3090,109,10,1,5.2,15.9
Round1,"SXYTHEE 父, ԜOLFE, Cobrа ﾒ",3091,109,10,1,5.2,17.0
Round1,"Ålpha Alb, OFMPrince, Worstplayer Nae.",3092,109,10,1,5.1,16.0
Round1,"ver0vv, ΨIM SO GOODΨ, Rebva",3093,109,10,1,4.9,16.0
Round1,"sub to frrosty1, ruinzz ﾇ, youtube indoszn",3094,109,10,1,4.8,16.6
Round1,"Malik Vaughn, pointz boy toy, FNCS Pointz",3095,109,10,1,4.6,14.9
Round1,"kyаx, youtube syncwyd, 67 Magma",3096,109,10,1,4.6,16.5
Round1,"igl zegg, redicle., omqg",3097,109,10,1,4.4,12.9
Round1,"mr spatial, RTM xMantisk, Bresaus",3098,109,10,1,4.4,15.4
Round1,"KC Halt YT, Dαis, R2K4 ϟ",3099,109,10,1,4.4,15.8
Round1,"demoп., ShotaBlood, Purebred yes",3100,109,10,1,4.3,13.8
Round1,"MRKS ., Oшl, ǃTRASHAROONIEǃ",3101,109,10,1,4.3,15.2
Round1,"Jordann父, twitch alowyd, BG Antho",3102,109,10,1,4.3,16.0
Round1,"MrAntss, Leano1ツ, Blix Θ Θήτα",3103,109,10,1,4.2,14.6
Round1,"Jitch, mexzy ay лол, ZFranks",3104,109,10,1,4.2,15.2
Round1,"Sandy wyd, TEV父, KRUGER .",3105,109,9,1,4.11,13.22
Round1,"Xryo Ψ, blackstar is IGL, Cqsh.",3106,109,10,1,4.1,13.6
Round1,"Wizеy, GazaliFN, YemeniFN",3107,109,10,1,4.1,13.9
Round1,"Garxeszillo., SFL Allx ヤ, Excaliiber.",3108,109,10,1,4.1,14.9
Round1,"Ruckrr, ВuiIdzrr, TurfierOnTwitch",3109,109,10,1,4.1,15.3
Round1,"TTV real_rafael1, vs botified, salty.szn",3110,109,10,1,4.1,17.0
Round1,"Radiant Dryx, Carry_de_K1nvar, Señora Christian",3111,109,9,1,4.0,11.33
Round1,"Gucci Damelio, tuffybass, Leftyrr",3112,109,10,1,4.0,13.8
Round1,"sxignal, OVA Kaleemriley, Michigan_Fan4Eva",3113,109,10,1,4.0,15.5
Round1,"Jezus - ᴡᴀʀ, Verwin., War theboomshotl",3114,109,9,1,4.0,16.33
Round1,"Hyterior on YT, Youtube Zodac, youtube volticz",3115,109,10,1,3.9,15.9
Round1,"United Succy, Exhzy, PiezasControlNru",3116,109,10,1,3.9,16.5
Round1,"Clarity AP, IGLSkyzz, Vert AP",3117,109,9,1,3.89,12.67
Round1,"Crum ツ, avikayelol, KingOpie",3118,109,10,1,3.8,14.2
Round1,"Im Mc Lovin, auxtn on yt, Daddy Drifty",3119,109,10,1,3.8,15.3
Round1,"ѕpahzn, ejarr., Jaggersϟ",3120,109,10,1,3.8,17.5
Round1,"Grotus., Washed Ortega 神, NKD Nvtx",3121,109,9,1,3.78,11.33
Round1,"The BIG Xzen, Retired Random, BlessFN YT",3122,109,7,1,3.71,8.0
Round1,"pﱞepﱞpa, roze luvs moms, Оead",3123,109,10,1,3.7,11.9
Round1,"FaZe BI-DEN, wavy 地, Weapоns",3124,109,10,1,3.7,13.2
Round1,"DogeCoin To 1, troIlin, Twitch Smartyfn",3125,109,10,1,3.7,14.0
Round1,"3l viejo Jenkins, RasethWhale大, Primo Kachiporra",3126,109,10,1,3.7,14.4
Round1,"DVN Triig, DVN Smokk, DVN Zero",3127,109,9,1,3.67,14.44
Round1,"Devin3310, MetryG, orjeeX",3128,109,10,1,3.6,13.0
Round1,"Clipbot huī, lil Entry vert, YSL Miggz",3129,109,10,1,3.6,13.3
Round1,"IceyCloud18, JKC luvs Dasani, Johto.",3130,109,10,1,3.6,14.1
Round1,"Positive Siz, LQR Drapqq 父, LQR Tavamper Ψ",3131,109,10,1,3.6,16.3
Round1,"UL Slow Modeッ, FNCS ALEXISSJ, ꜰɴᴄꜱ ᴀᴅᴀ.",3132,109,9,1,3.56,11.11
Round1,"UnknownWolfIsShy, lil ŋıƈơ vert, lukerz on yt",3133,109,9,1,3.56,12.0
Round1,"Noxy 爆, Thunder FNCS3, Piece ctrl caba",3134,109,10,1,3.5,12.2
Round1,"YT-Cam is beta, kazro is beta, gnnaio",3135,109,10,1,3.5,15.0
Round1,"epikhoward.tv, Your Honor., Swindler Buhgzi",3136,109,10,1,3.4,17.1
Round1,"Foreigner Psycho, 4saken Noshlen, Ψ G O D",3137,109,10,1,3.3,12.8
Round1,"le rádiez, TTVCharrredFTW, Catnip Boxed You",3138,109,10,1,3.3,12.9
Round1,"fanboygarchi say, Bull Dont Cares, Quiubo ps Mor",3139,109,10,1,3.3,13.4
Round1,"Tер, cozys, vіеw",3140,109,10,1,3.3,14.9
Round1,"Zwheelsﮎ, Smoovе, NotLilLewi",3141,109,10,1,3.3,17.2
Round1,"AffirmingBody80, Chill juxxy, mar de reszyxz",3142,109,9,1,3.22,11.89
Round1,"Skepzﱞy, Kenzﱞu, Baﱞli",3143,109,10,1,3.2,13.6
Round1,"Jolty ., dyln owa owa, Ʈruett",3144,109,10,1,3.2,13.7
Round1,"jojoking05, Elmerrrr_04, FaDe_Aimsz",3145,109,9,1,3.11,12.56
Round1,"VERSE 21, shevlantae, zlko eats cheese",3146,109,9,1,3.11,12.56
Round1,"74Zhxng, 74Toxic, Spktl",3147,109,10,1,3.1,14.0
Round1,"L2R2Rustyツ, Er3 ᛦ, LyricalDemon 細沙",3148,109,10,1,3.1,16.3
Round1,"Support RAFFE, YouTubeDeMarkooo, Ｐｕｇｚ",3149,109,9,1,3.0,11.11
Round1,"Booneboyz2, Azoticc., Solomon .",3150,109,9,1,3.0,12.0
Round1,"Ak Enrykez., Mαttx, ᴸʸˣᵘˢ ᛋ",3151,109,10,1,2.8,12.3
Round1,"Coachddt, H1ghtss, GVU.Cubawabi",3152,109,10,1,2.7,13.1
Round1,"booonkus, The_ShortGamer, stepbro mud",3153,109,10,1,2.6,14.0
Round1,"STHOCKEY11, Big pp Hxrizon, big pp marty",3154,109,10,1,2.3,13.8
Round1,"LWJ_GGus, AlanTRETCH 神, joshua auhs1",3155,109,9,1,2.0,10.0
Round1,"Rkainn 父, Esteban ö, AyyyDinoo",3156,109,10,1,2.0,12.2
Round1,"divine 堡迪, DemonBow, ChopΨ",3157,109,7,0,8.29,15.29
Round1,"VLC dodo, VLC koala, VLC Bouffon",3158,109,6,0,7.67,11.67
Round1,"Tapxz メ, Moss 莫, glowy on 165hz",3159,109,10,0,6.0,14.8
Round1,"BBG XTRA LOB, сalеb., BBG XTRA CREAMER",3160,109,10,0,6.0,16.8
Round1,"Chazz gonorrea, monroyhpmlp, kg Nwixzzϟ",3161,109,10,0,5.8,17.0
Round1,"zxptry, Fear Koala Ψ, Fear fighta Ψ",3162,109,10,0,5.7,15.9
Round1,"S8 ice, Captain Lilmush, umD Bunkerssz.",3163,109,10,0,5.7,16.3
Round1,"reloadǃ, NotZelo on YT, ULTRAMON 父",3164,109,10,0,5.7,16.4
Round1,"wundrrfn, TTV.SpyBones, Buglano",3165,109,10,0,5.5,13.0
Round1,"lil zex vert, ŞtarFN, Nohxi Ψ",3166,109,10,0,5.4,13.6
Round1,"decoy2k7, Ace Flumkins, a fishǃ",3167,109,10,0,5.4,15.1
Round1,"J-POCALYPES, KChen48, XTRA Jarquevo",3168,109,10,0,5.3,14.0
Round1,"Cheechϟ, Сreеpy, Trepz on youtube",3169,109,10,0,5.3,14.6
Round1,"ㅤㅤstormz, Reefϟ, AAA Mitt",3170,109,10,0,5.3,15.2
Round1,"ESC Joey, Twitch K1ung, Mixsyu",3171,109,10,0,5.3,16.8
Round1,"ESG SìrǤanNsŦ ڴ, Emzy Ducking., Emzy Newzone 父",3172,109,10,0,5.2,15.6
Round1,"Rеzox, lijahlol, fun size klu",3173,109,10,0,5.1,13.3
Round1,"Worst Player Xiô, Nat Ψ, brkу",3174,109,10,0,5.1,14.1
Round1,"TTV IamTiag0, polônio., Fгeitas",3175,109,10,0,5.0,15.2
Round1,"Rstn 2, Jctn 2, mixy.",3176,109,10,0,5.0,15.2
Round1,"piece ctrl slitz, wizzﱞzzz., Sacridz.Tv",3177,109,10,0,5.0,16.1
Round1,"Repunkz.OB, OB Crypto, L2 wric",3178,109,10,0,4.9,13.3
Round1,"McPP Kris, Aasarissuaq., Unterr ay лол",3179,109,10,0,4.9,13.8
Round1,"Pure Nuked7, JermzsFlo, RESAFFY",3180,109,10,0,4.8,15.2
Round1,"kenpachi cai, BIG BLOWFISH恶魔, sneakѕ",3181,109,10,0,4.8,16.1
Round1,"Detective Mew, YEAH I RUN 240, Luckiest.",3182,109,10,0,4.5,12.7
Round1,"eacaps luv blake, DEMON MALCOLM, SURMA 文",3183,109,10,0,4.5,14.1
Round1,"sand monke, BQQG WWG1WGA, amіr",3184,109,10,0,4.5,14.5
Round1,"Jinx Ώ, Sir Jeshington, specs luvs muvas",3185,109,10,0,4.5,14.7
Round1,"akaSpidzﾒ, ʝаx 父, 20m earnings",3186,109,10,0,4.5,16.3
Round1,"MLGJRatedd, antіc on youtube, Twitch Goop1x",3187,109,9,0,4.44,12.0
Round1,"Twitch nho_kb, snipez ay лол ., evez ay лол .",3188,109,9,0,4.44,12.33
Round1,"xo davids, xo jеrry, Nastyﾒ.",3189,109,10,0,4.4,13.4
Round1,"7RG Luqe, 7RG Synopse, Twitch Cynzyfn",3190,109,10,0,4.3,13.9
Round1,"Hoodie Tone, Hoodie Schupp, Call Me Gene",3191,109,10,0,4.3,14.5
Round1,"xKonter 弟 muñaño, Stormy Peruvian, Forever Ryze",3192,109,10,0,4.2,13.3
Round1,"V4rgas ay лол, Ivorapper, nott_valentinoMT",3193,109,10,0,4.2,14.1
Round1,"YuhSkys., zclonxwyd, Clqppz",3194,109,8,0,4.13,11.25
Round1,"Twitch AntixFtn, kenjiwyd YT, YouTube vJahmL",3195,109,10,0,4.1,14.6
Round1,"beаstiality, qіs, cwintr",3196,109,10,0,4.1,15.3
Round1,"Zintex on SX, ΗapSenshuu 幸, Milky777ネ",3197,109,10,0,4.0,12.8
Round1,"blаker, Saltу., Master Duck.",3198,109,10,0,4.0,15.7
Round1,"Ken.斯, PalacioΨ, Larax 父",3199,109,10,0,3.9,14.0
Round1,"K0N0HA M4R0U, A4B_Aniss, A4B_Rami",3200,109,10,0,3.9,14.3
Round1,"B R L., David C40, Uzigas",3201,109,10,0,3.9,14.4
Round1,"Zairysツ, Twitch Whtiz, Cryptic_Unknowny",3202,109,10,0,3.9,14.9
Round1,"pаniq, Twitch Orvko, Twitch Wh8t",3203,109,10,0,3.9,16.3
Round1,"Twitch PomiFTN, Вaguette, Сringy",3204,109,10,0,3.9,16.8
Round1,"Xen duwy, XANIES ǃ, Not Crumz",3205,109,10,0,3.8,13.1
Round1,"tipe 形, Ànt., b8nо",3206,109,9,0,3.78,12.0
Round1,"KrypticFN-, eVanguards, M4tt._.h3w",3207,109,10,0,3.7,13.5
Round1,"cLogicalsTTV, Ahgenda.ttv, TTV.Treeshnn",3208,109,9,0,3.67,11.11
Round1,"GetPokeBalled69, Frоstyrr, Bailout Lyhtrr",3209,109,10,0,3.6,13.4
Round1,"austwyd, nооb kazzy, なとヤギ",3210,109,10,0,3.5,12.6
Round1,"azk alexan ム, Fleesly ム, ʙᴏᴜᴛʏ ム",3211,109,10,0,3.5,12.8
Round1,"use code kawaka, Fumi LGBTQ, Sαphır кıngz ϟ",3212,109,10,0,3.5,12.8
Round1,"BigJustBoxedU, SkrIm_Dadi, V.KingIV",3213,109,10,0,3.5,12.9
Round1,"SxcredOnPaddles, LD Dogs On Coyle, piece ctrl Treヅ",3214,109,10,0,3.5,13.7
Round1,"CC JA3FN, Cowboy CC, DEMON TROPICZZ",3215,109,10,0,3.5,13.7
Round1,"Snow父, DMN Ghoos, doc ム",3216,109,10,0,3.4,14.4
Round1,"Assortedtick208, Mszyon60fps, คɭ oภ Շoק",3217,109,10,0,3.3,12.8
Round1,"Тwіх, Antreyli ӝ, Dеzz",3218,109,9,0,3.22,10.78
Round1,"Sideways lol, THE BIG YAPPER, NTNS Luffy",3219,109,9,0,3.22,11.33
Round1,"LIWILL, Jaw ., oPolarTV",3220,109,10,0,3.2,14.9
Round1,"Gholson, GPKING27, richbirdie",3221,109,10,0,3.1,11.5
Round1,"Support Blaze, Blﱞﱞﱞﱞﱞaze, Fragger Lemurs",3222,109,10,0,3.1,12.5
Round1,"DEMONSOKEZ, Tsunamiㅤ, tuber lol",3223,109,10,0,3.1,14.5
Round1,"ClipsѰ, WST Rezzi, Vas Eh 30",3224,109,10,0,3.0,12.6
Round1,"Wínter AY ЛОЛ, skyliﱞn, Cóòkie ay лол",3225,109,10,0,3.0,13.0
Round1,"SwankyOnPºrnhûb, Desire Min, Synx-F5",3226,109,10,0,3.0,14.0
Round1,"obie〆, Cаper, Кonnеr",3227,109,9,0,2.67,11.56
Round1,"IGL GAINZΩ, Squidward 父, Dаytоn",3228,109,10,0,2.4,11.0
Round1,"ズ私 Mike., ズ私 Swifty., ズ私 Noxy.",3229,109,10,0,2.4,11.1
Round1,"Respectful Fizz, D3mon T3rtle, Aero 74",3230,109,10,0,2.4,12.7
Round1,"rip nugget, Caroline ッ, 999 hannah",3231,109,10,0,2.4,13.4
Round1,"twitch benjifys, jbabbstreams, Lizmhog么",3232,109,10,0,2.3,13.3
Round1,"I Defy Space tv, prysucks, FIVE ON 0 PING.",3233,109,10,0,2.3,13.6
Round1,"TTV_Redworm_222, FMJboi3104, firehost -a-",3234,109,9,0,2.22,9.78
Round1,"dom ay лол, bestplayerslaet, FLu Hypexǃ",3235,109,10,0,2.2,14.2
Round1,"TTVskywalker12lv, pakman1234, Jtchitla",3236,109,9,0,1.89,10.22
Round1,"coda cant igl, Munk got shortys, Gomez 雷",3237,108,4,2,11.5,10.25
Round1,"DUDU CXMISA 9, PROERDs, ARRAXTA PRA CIMA",3238,108,10,2,5.0,20.7
Round1,"Jitter ψ, IGL HENY, Тоbіаs",3239,108,10,2,4.6,16.2
Round1,"Phоenіх, Use Code Jopo, dotta1x",3240,108,10,2,3.9,17.4
Round1,"Zanos Lucid, YouTubeFyshy, BCG0503",3241,108,10,2,3.8,18.4
Round1,"NBDCIV, KingStevieee, Splix 1st",3242,108,10,2,3.5,14.3
Round1,"Tavo_Uchiha, SkŸZ ay лол, J Ø Š Ë",3243,108,10,2,3.4,13.0
Round1,"flipzzж, Flayze YT, Murowp",3244,108,10,2,3.0,13.0
Round1,"DEMON SCOOB, nﱞoﱞaﱞh, tiІol",3245,108,10,2,3.0,15.1
Round1,"Sly spanked me, Zayaroonie, Communist Sly",3246,108,10,2,2.6,13.2
Round1,"twitch gramotb, JATT DUFFY, Punjabi Lxllo",3247,108,10,1,5.8,17.8
Round1,"owa owa obie, Sneezyϟ, L2 Vertally.",3248,108,5,1,5.6,3.8
Round1,"ＸｅｌａＢｏｘｅｄＵ, luhx iwnl., Twitch xDanteq",3249,108,10,1,5.6,15.9
Round1,"Cуrix, ТІММҮ, onshore luv ivy",3250,108,10,1,5.4,15.1
Round1,"JudeWT, NatsuWT文, DEMONTIMA",3251,108,10,1,5.4,16.7
Round1,"Spot idk, flowtf on yt, Twitch Maxiwnl1x",3252,108,10,1,5.4,17.2
Round1,"Zuibarr, Extersion, ExecutionFN",3253,108,10,1,5.3,16.9
Round1,"Aim Assist Frags, ENDLESS JUMONN, Jaydoose_Bum120",3254,108,8,1,5.25,13.13
Round1,"KingJontae_ 13, bologn4, pixobtw",3255,108,10,1,5.0,16.0
Round1,"Patato le boss, reWASD Nurcy, SkyyzFN",3256,108,10,1,4.9,15.5
Round1,"frigidlol, TRAJIC 父, Twitch Drnoaie",3257,108,9,1,4.89,13.11
Round1,"LKT Tony, Demonickles, LKT Vinny",3258,108,9,1,4.78,14.33
Round1,"ogui ϟ, MУthic., T3RTIARY",3259,108,10,1,4.6,14.2
Round1,"treat_tv, ttvplayboycuddi, ParkerIsYourDad",3260,108,10,1,4.6,15.7
Round1,"skizzy is cupid, Ai Eats Chipotle, Dream3x on Yt",3261,108,10,1,4.5,14.4
Round1,"machreyli, cozყ, wqlker父",3262,108,10,1,4.5,14.9
Round1,"The BIG papapark, KINGTERTHROWS, Cakir Throws",3263,108,10,1,4.5,18.0
Round1,"iSypo, Reputate Youtube, Twitch MyskiGG",3264,108,9,1,4.44,12.78
Round1,"Fibe on SARMS, Tres416 on IG, J4 ⁱˢ ᵈᵃᵈᵈʸ",3265,108,9,1,4.44,13.89
Round1,"Sin real Shiesty, Vezy on YT, Siege 私",3266,108,10,1,4.4,17.1
Round1,"2021 Flow 盒裝你, IM CAUSE BRUTUS, Fly me 2 da moon",3267,108,9,1,4.33,16.0
Round1,"Instagram Klawi, v14 juancho, SKGรcyʆɑx",3268,108,10,1,4.3,15.7
Round1,"Corn Cob., Mancake Maniac, Default Demon.",3269,108,10,1,4.3,17.2
Round1,"Sosa 〆, xothrax, jvmmy",3270,108,9,1,4.22,11.89
Round1,"EP fst, EP jhn, Javeriano Alejoh",3271,108,10,1,4.1,12.8
Round1,"Eye Take Ls, Exodia in Raf, Eye TakeLs",3272,108,10,1,4.1,13.5
Round1,"twitch decentzz, Twitter TbSync, Сlink",3273,108,9,1,4.0,12.67
Round1,"iDEALѰ, controlla naf, Prospy ψ",3274,108,10,1,4.0,14.3
Round1,"Baby DaLxiq, ttv_Stanley_Mir, Bᴀʙʏ ɴᴇʟsɪᴛᴏᴏ",3275,108,10,1,3.9,14.6
Round1,"Mozurk, Opqosite ay лол, DEMONPAGNE",3276,108,10,1,3.9,15.1
Round1,"LunaOnTheWorld, ZmanSauceeYT, BLOCKSFPS",3277,108,10,1,3.9,15.2
Round1,"enzofishy, fishyreg, dyyyyzi",3278,108,10,1,3.9,15.6
Round1,"E-girl Fixtty, E-girl Prxshe, E-girl Reazzy",3279,108,10,1,3.9,16.4
Round1,"asprin loves hiz, Jesse DatGoat, drake on molly",3280,108,10,1,3.8,14.0
Round1,"НЦNТER, Twitch WydOrbitz, EpikﱞflixLol",3281,108,10,1,3.8,14.1
Round1,"ENDLESS SPRAY, IGL Dream, 0 earns Clapzy",3282,108,10,1,3.8,16.4
Round1,"LockeD FC, scutta drew, Μoose.",3283,108,10,1,3.7,14.1
Round1,"lil Lucky lmao, lil Traz lmao, 0 Ping Kiyoz",3284,108,10,1,3.7,14.9
Round1,"twitch_lic4nex, TwitchDLGogu貝倫, YT_Tacofutbolpro",3285,108,9,1,3.67,12.11
Round1,"Edderrr, Funko1x, PERSIFY 父",3286,108,10,1,3.6,16.0
Round1,"UptownFN TTV, best aim Fun, Twitch Slouchyx",3287,108,9,1,3.56,13.11
Round1,"ʜᴜکН, ⱽᴳJezz, VG ʀᴀᴢεʀ.",3288,108,10,1,3.5,13.5
Round1,"Divеrged, nae noahreyli, bby splash",3289,108,10,1,3.5,13.6
Round1,"Gαldi, OWA sigh., IGL Leyo",3290,108,10,1,3.5,15.1
Round1,"Matesah, XTRA illeѕt, Наil.",3291,108,10,1,3.5,15.5
Round1,"7T RUBENMON 至, 7T Hybz, 7T zуzєnズ",3292,108,9,1,3.44,11.11
Round1,"ВLURRҮ, Skааv, Hyco ϟ",3293,108,10,1,3.4,15.4
Round1,"Teabizzz YT, SaVe Atlas, Muffn On YT",3294,108,9,1,3.33,11.78
Round1,"outcast heiperx, TD nick, SF DEMONEVIL",3295,108,10,1,3.3,13.0
Round1,"Lυαɴ, Prxtto, bOSta_gamer_3247",3296,108,10,1,3.3,14.0
Round1,"YouTube Kunaqua, drazaquaaa on YT, She hates forna",3297,108,9,1,3.22,10.56
Round1,"RHYTHM 1ST 父, Cal 1st, Trxy 1st",3298,108,10,1,3.2,13.8
Round1,"AlexWinsSlurpy, JorneyWinsSlurpy, MistWinsSlurpy",3299,108,10,1,3.2,13.9
Round1,"Twitch Reset 父, reset wuvs Hatem, MJテ",3300,108,10,1,3.2,16.8
Round1,"Stiffie on 240hz, ibbỹ, crazysync",3301,108,8,1,3.13,9.0
Round1,"0 IQ Krayon, Аng, KETO MISS JUICE",3302,108,9,1,3.11,13.22
Round1,"Tеarѕ, Kyroㅤﾠ, рeso",3303,108,10,1,3.1,14.1
Round1,"Simp 4 JinxQueen, killua 光, Myke Ƭowers",3304,108,10,1,3.1,14.2
Round1,"Ajolote Furioso, tachogomez1997, quezadaleo -GOD-",3305,108,10,1,3.1,14.6
Round1,"ᴴᴱᴿᴬSimpdeAme, marcochavez69, Mayexu",3306,108,10,1,3.0,12.6
Round1,"anesrampage, B0NGZTV, 9一X",3307,108,10,1,3.0,14.1
Round1,"AlBaX ツ, FNCS FreshFTN, Zeyrox lol",3308,108,10,1,2.9,12.3
Round1,"Yeet is Angry, swеbs, OneEye Is Angry",3309,108,10,1,2.8,13.1
Round1,"Beane 〆, Twitch Klood1x, Kuya.",3310,108,10,1,2.7,13.1
Round1,"Ǥσʟɪατʜ 父, Bichota Mythical, striker ay лол",3311,108,10,1,2.5,14.1
Round1,"twitter kvhisfn, Sqrr๔, jorqΩ",3312,108,9,1,2.44,11.0
Round1,"twitch Starz_FC, Nitr0._, ZeeTox.",3313,108,10,1,2.4,13.0
Round1,"Ralymoto, W . A . S . D, K . S .",3314,108,10,1,2.3,12.5
Round1,"Schlindererpro, Dustin_on_KBMx, Smitty on 60fps",3315,108,10,1,2.0,13.0
Round1,"twitch pogkyle, POG Lou, RaveinFN",3316,108,9,0,7.22,15.78
Round1,"haisuuuu, Reykho_, Ha1su",3317,108,10,0,6.6,16.3
Round1,"Brilliant Bachi, tom plus marina, EthanPlusTommyFN",3318,108,10,0,6.4,17.2
Round1,"NAZZY 父, ﱞ krypto, Benderrツ",3319,108,10,0,5.9,15.7
Round1,"nexzify, zigmark 父, Zuronies",3320,108,10,0,5.8,16.2
Round1,"local club ddel, Better Playеr, YOYOH3LLO",3321,108,10,0,5.4,13.9
Round1,"Jsznn., ΑRKMON, DiIdo Rzxor",3322,108,10,0,5.3,14.3
Round1,"Gossle., Tiktok Zveas, Traversal-",3323,108,10,0,5.3,14.7
Round1,"LaAlice ツ, The Big Carry TS, TS Ƥablo 03",3324,108,10,0,5.3,15.6
Round1,"60ƤĺƝƓ, Lil Tib, Joey gets 0 puss",3325,108,10,0,5.2,14.9
Round1,"Βrosauce, Classik on kbm, jays 7",3326,108,9,0,5.11,13.67
Round1,"Saeиz, Rorra ay лол, Chelu Pro ﾒ wkey",3327,108,10,0,5.1,12.7
Round1,"Yunσ, DemSticks, Іitо on SARMS",3328,108,10,0,5.0,14.1
Round1,"BurritoMuncher32, Hθkey, Drizzlеz",3329,108,10,0,5.0,15.6
Round1,"youtube kwetoo, sub to kwetoo, mari is skinny",3330,108,10,0,4.9,15.3
Round1,"Owen J., Code Regret, User-399c81c4c6",3331,108,10,0,4.9,18.7
Round1,"twitch zxthfn, Loopex., JTwoo.",3332,108,9,0,4.89,14.67
Round1,"iDrixp is Daddy, Shenzricc, Luisrecks2109727",3333,108,7,0,4.86,8.0
Round1,"Youtube foliefn, ZUMA ZUMA 父, Z1nq FC 父",3334,108,10,0,4.8,13.0
Round1,"DvniFNCS, Eternal Roberto, PieceCtrlWater.",3335,108,10,0,4.8,14.2
Round1,"RAJA_YT, KnownjeffwiId, LucidButtcrack69",3336,108,9,0,4.78,11.67
Round1,"Lil Zekie yt, Dеnzy, Sub to lil zekie",3337,108,10,0,4.6,13.3
Round1,"didnt qual lol, FNCS Hostyl, vertΧ",3338,108,10,0,4.6,14.3
Round1,"fast davidli., fast halero., storм controller",3339,108,10,0,4.6,15.6
Round1,"JXs Qt 最好的, Isaacnin0, PapiCakesツ",3340,108,10,0,4.6,16.3
Round1,"Avoid Suhnys, Avoid Luv, WOO BACC SANI",3341,108,9,0,4.56,13.89
Round1,"Polluelo ay лол, dati ., Great orrego",3342,108,10,0,4.5,13.4
Round1,"999Amari, ᵒʳʸˣ, 0 iq rabbit",3343,108,10,0,4.5,14.2
Round1,"chееf, Razed1x, gdawg-_-",3344,108,10,0,4.5,14.4
Round1,"Dragzπ, Dustii., ttv Louieisok_",3345,108,10,0,4.5,15.5
Round1,"ErinHickey6969, Code ThEvolved, twitch duffyfn_",3346,108,10,0,4.4,14.2
Round1,"Caррs, BH elipzy YT, DL Cobzy Yt",3347,108,10,0,4.4,14.6
Round1,"mаrz ツ, TIMEQZZZZZ, Dragonfruitman23",3348,108,10,0,4.4,16.2
Round1,"0 Ping Mike, FL slump, kizer on krak",3349,108,10,0,4.3,13.1
Round1,"Jai Diesel, marlinn., voltaic aimer",3350,108,10,0,4.3,13.6
Round1,"youtube kasei, youtube ohgriff, Use Code Zomby",3351,108,10,0,4.3,13.9
Round1,"Kexzi, ROGΕRS, Regularbrd",3352,108,10,0,4.3,14.4
Round1,"Jitterbug Claud, fragger bray, igl brice",3353,108,10,0,4.3,14.6
Round1,"I love u mariel, GΛMƧ, Fake Bergraal",3354,108,10,0,4.2,12.6
Round1,"Evaxay 父, siаh ψ, Suade ψ",3355,108,10,0,4.2,15.6
Round1,"cintholoscity, Master is Senpai, Ghilx.",3356,108,10,0,4.2,16.3
Round1,"卄8 ﾌ卂Ҝㄖ乃, LoGic VΣFA, tata is ur daddy",3357,108,9,0,4.11,12.0
Round1,"ace astros, еasy父, BESTXI YT",3358,108,10,0,4.1,14.6
Round1,"code brady1x., FNCS.Bick, YøSwarm on YT",3359,108,9,0,4.0,11.33
Round1,"xorcigol, Sotе, 6ths",3360,108,9,0,4.0,12.44
Round1,"xyrohh is washed, ang gteam, sigma 〆",3361,108,10,0,4.0,12.8
Round1,"YoutubeSoftlyX, Oxyvez on YT, rennaTTT",3362,108,10,0,4.0,13.5
Round1,"Droumk ώ, The Kid Shinsow, The Kid Danrok",3363,108,10,0,4.0,13.5
Round1,"Lil Yuvy Vert, Ηunt., twitter goryyfn",3364,108,10,0,4.0,16.0
Round1,"Marc лол, GenieStinksツ, GenieبGnFَّ",3365,108,10,0,3.9,12.8
Round1,"シ ᴳⁱᵒʰˣᶜ シ, TwitchPeteFishy_, Zh3k0ⁱⁿ ᵗʷⁱᵗᶜʰ",3366,108,10,0,3.9,14.1
Round1,"mk inferareyli., Tenpox Kong, mk Galo",3367,108,10,0,3.9,16.0
Round1,"lll blikzy ɮρ, sxcaritax, PePe loves mami",3368,108,9,0,3.89,12.11
Round1,"fxxed, Twitch oqud, ﱞcrr",3369,108,9,0,3.89,12.56
Round1,"ᴳᵒᵈGerryZz, rumpelstinsking, ƬᗯᎥƬCᕼ-G0DDRAGǾ",3370,108,10,0,3.8,11.9
Round1,"Youtube Yunnor, KloZuxz, gwds.",3371,108,10,0,3.8,12.4
Round1,"NinjaREZ, EMS gowther, EMS Jay",3372,108,10,0,3.8,13.1
Round1,"ˢᵃᵍᵉChurrumai快, ˢᵃᵍᵉLowi茶, Loiscall",3373,108,10,0,3.8,14.6
Round1,"Zumo on High, clin y chiquita, Pumped By Sfuy",3374,108,10,0,3.8,14.9
Round1,"sniped by nizz, Jivyy sandwich, egotistical null",3375,108,10,0,3.7,13.3
Round1,"goat down bad, StreakBTW, The Face.",3376,108,10,0,3.7,14.9
Round1,"Neon-α-, Tylеz, editedbystagy",3377,108,10,0,3.6,12.5
Round1,"Dr. S I N, mikahwhy, Big Riv.",3378,108,10,0,3.6,12.5
Round1,"twitch.lawfn_, the diddler., YT TTV IG Bogite",3379,108,10,0,3.6,12.9
Round1,"Zurpha ϟ, TheKrxken, PL killer .",3380,108,10,0,3.6,13.3
Round1,"godzi ау лол, drasxne ау лол, vZeal on YouTube",3381,108,9,0,3.56,13.11
Round1,"Polit el Sexy, cocufn on ig, a.xplox",3382,108,10,0,3.5,11.9
Round1,"ApollonΨ, LNDT hadès, Кagi",3383,108,10,0,3.5,14.4
Round1,"Ytry Bish, Papi1x, FlacidTv",3384,108,10,0,3.5,15.2
Round1,"twitch verzeg, iM Varuc, uhJeaan.",3385,108,9,0,3.44,11.33
Round1,"Jacob〥, impalа., LUCIDMONN",3386,108,9,0,3.44,11.67
Round1,"Neptune Δ, frosti 金, marsδ",3387,108,9,0,3.44,11.78
Round1,"Tulss., Adrianϟ., FB_Tebo",3388,108,9,0,3.44,12.44
Round1,"Brayden9700, chr1sssyb, Dеxy",3389,108,10,0,3.4,11.7
Round1,"Nobu Bodyy, Vexo Potvin, jemceee",3390,108,10,0,3.4,12.0
Round1,"Fb SmigoL 乂24k乂, 1 ØMFGØK7 ϟ, 1 Withedy7 ϟ",3391,108,10,0,3.4,13.8
Round1,"kuappii, ANDREZZ 帕達, lil owish vert",3392,108,10,0,3.4,14.3
Round1,"Alejin., mendoza 神, DelightfulEarsHN",3393,108,9,0,3.33,11.22
Round1,"Amibo 汐, cade on SARMS, XTRA Seleqs",3394,108,9,0,3.33,11.56
Round1,"king el pau, ᵇʳʳ Kevincavi, deal with hernan",3395,108,9,0,3.33,12.33
Round1,"FLUX 地, FΑΤΕ 父, ΚΒΜ ΠΚ Ψ",3396,108,10,0,3.3,12.5
Round1,"Sloppydessert418, tx zekayda, kontraplex",3397,108,10,0,3.3,12.6
Round1,"J.King_, Yoyomauricio, YungSaxEsq",3398,108,10,0,3.3,13.5
Round1,"IGL Cantondobra, PS4 pepe, menguaaa on tw",3399,108,9,0,3.22,11.89
Round1,"50 Ping Maniac, DANIELㅤLOPEZ, Rocky Balboa .",3400,108,10,0,3.2,12.1
Round1,"Kirk 〆, Ruthless Ω, xaari ϟ",3401,108,9,0,3.11,12.0
Round1,"Code Amozoc, Llamasense tv, FNCS Motionz",3402,108,10,0,3.1,13.0
Round1,"Flix Luvs Kondor, quiхiе, DestroyerEh30",3403,108,10,0,3.1,14.2
Round1,"sᴡɪʟʟʏ, alaiᵢ, kshanns",3404,108,9,0,3.0,11.67
Round1,"Anby on top, 9 9 9 Erx, PH G7ngris",3405,108,10,0,3.0,12.6
